id,text
1558607118,"Kula Kaymakam Kemal Duru visited volunteers at Kula Hacı Ömer Özboycı Occupation and Technical Anadolu High School, which began to produce masks under the protocol co-signed by Manisa County National Education Directorate and the City Health Directorate."
1530377691,President Recep Tayyip Erdogan told Azerbaijan at the last minute prior to his move that two of our soldiers were martyrs in Libya.
1616651613,"According to the latest assessments from meteorology, the interiors of the Aegean are under the influence of heavy showers in western Anatolia and western Black Sea. Lodos are expected to be effective in the inner and eastern regions from the south and southwest. Other regions are not expected for any significant change."
1558318470,People with chronic illness in Tekirdağ who are 65 years of age and older are generally responding to the call to stay at home under coronavirus measures.
1535325643,"From the turning points of Turkish and world history, the story of the youth volunteering for the Battle of Çanakkale, my handkerchief, Kekik Smere, is preparing to meet the audience."
1607746508,Journalist Fatih Orange has made a statement on the news that the New Age headline has included details of his land and has been targeted.
1489584157,The number of families who launched a sit-in in front of HDP Diyarbakır Province (HDP) on charges of kidnapping their children by terrorist organization PKK members has risen to 65 on the 128th day.
1598158701,"Last-minute Current News -- some exceptions in the curfews of entering and exiting the Metropolitan and Zongukdak following the first curfew started on April 3rd. Citizens who wish to enter cities where they have a curfew will apply for a travel permit through the E- State. After the application has been submitted to evaluation, they will be granted travel permits! But how will travel permission be applied?"
1516082727,Women's Wrestling Team coach Efrahim Kahraman said they were ready for the European Championship.
1628310008,"In Manisa, it was discovered that the driver who left his car and disappeared 15 hours after he flew into the irrigation canal during the night was in his home, while the footage of the accident occurred on the security camera of a workplace as the investigation was under way."
1577888989,"Misra (9) and Hüseyin Aydın (12) brothers in Sakarya donated 152 lira to the National Solidarity Campaign, launched by President Recep Tayyip Erdogan to buy a laptop."
1615475205,"In Talas district of QAYERI, four isolated homes were quarantined after a test of coronavirus tested positive for one person who went to the hospital complaining of high fever and cough."
1631063563,"A dramatic claim has been made on the beaches of the world-famous basement town of MUKLA about quartz dust, which is called white sand."
1532935619,The European Union has decided to expand its sanctions on Turkey due to the alleged illegal activities of the Republic of Cyprus's exclusive economic zone.
1558520014,President Recep Tayyip Erdogan discussed the execution with Justice Minister Abdulhamit Gul.
1558275994,"Selim Aydın, the father of Constabulary Chief Constable Mustafa Aydın has passed away."
1642927390,"2 cousins who escaped from the attacker bear in Ispirak neighborhood of Sarıkonaks district of İspılı district, were injured in a forest area."
1542820894,Breaking news: 4 people who have been poached as fugitives in Iğdır received a fine of $30944. 8 of them were found alive and 20 were caught by traps. The confiscated cakes will be released into the wild.
1577494436,"The fields began to plow in Kars, where the winter was harsh and long, and the farmers began plowing their fields."
1514448546,"When the United Kingdom finally leaves the European Union, the voices of independence rise once more strongly from Scotland, one of the four main elements of its kingdom, as political and economic risk to markets."
1558590184,"Shorter than Tekirdağ, the municipality of Süleymanpaşa continues its work against the coronavirus (Kovid-19)."
1594842754,"The Turkish Cypriot Medical Association, the Chamber of Turkish Turkish Medicines and the Turkish Union of Doctors of Cyprus, issued a statement saying that the gradual removal of the troops was to play Russian roulette."
1497478420,"Free Arduç, who stabbed and killed university student Ceren Özdemir, will be tried on Monday for aggravated life imprisonment."
1558595395,"The famous name of the art world had once conquered lung cancer, and now the corona has succumbed to the virus."
1577788489,Funeral services staff have been given training on the rules for funerals that have passed away from Koronavirus
1558514989,"In Fenerbahçe, football players and technical and administrative workers are testing for the virus, which has shaken the world, and has had its effect all over the globe and in recent days, sports..."
1632068406,One of the buildings built by Çorum City Hall in Kadesh Square is to be used as a library to the City Department of Culture and Tourism.
1484655650,"Turkey, the world, breaking news, veteransmansha, yübüp, sültpaşa, sutangazi, conqueror, arvutköy, magazine, politics, policy, current, police, security, agenda, last minute, flash, sports,"
1503027112,"Turkey, the world, breaking news, veteransmansha, yübüp, sültpaşa, sutangazi, conqueror, arvutköy, magazine, politics, policy, current, police, security, agenda, last minute, flash, sports,"
1588505469,"First Deputy President of the Turkish Football Federation, Servet Deputy, the country that ended its leagues without completing statements on the game calendar..."
1526446996,"The school, where the earthquake was severely damaged, collapsed under control in Baskil district of Elazığ."
1618868706,"The accident took place in Çal district of Denizli Province, where a 15-year-old brother's tractor was taken down, a 4-year old brother died, while another 8 - year - old sister was severely injured."
1627561213,"In Afşin district of Kahramanmarash, 25 people reportedly attended the engagement ceremony of new types of coronavirus (Kovid-19) were fined 85,860 lira."
1594653333,"In Italy, where the leagues are suspended due to the coronavirus, it remains uncertain whether the games will start again."
1558587235,National athletes assessed the postponement of the 2020 Tokyo Olympics due to the new type of coronavirus (Kovid-19) outbreak. - Anadolu Agency
1558562308,The father of Constabulary Chief Mustafa Aydın was buried in the former police officer Selahattin Aydın Antalya.
1558833268,Some traffic accidents took place in Sakarya and Bolu.
1564823157,Israeli police have claimed to have detained six Palestinians working on a new type of coronavirus Kovid-19 disinfection in the occupied East Jerusalem.
1601430334,TIBB-I NBEVI DANIEL FOR THE DAY
1575360539,"The discharged Algerian citizens were sent to their country because of the outbreak of CORONAVIRUS, and 12 Algerians who were placed in Karabuk's home were released after the symptoms of illness were seen."
1558575945,The Gaziantep Metropolitan Municipality will provide free transport services to pharmaceutical technicians from Metropolitan City for three months.
1569412922,"The TAAYSAD Research for Koronavirus Effects has increased the number of companies in the industry that plan to stop production altogether, hoping for the sector's June and after..."
1616050667,Strong rain is expected in the interior of the West Black Sea and north and west of Ankara.
1595223395,"As rent benefits continue for $960, many citizens are wondering how to make applications and what are the conditions. Citizens, the Social Aid and Solidarity Foundation are looking for e- State rent aid applications. Here are conditions set by the Ministry for Kira assistance."
1558639371,The price of gasoline has been raised by seven cents from midnight this evening. - Anadolu Agency
1592583692,"The United Nations Special Representative to Syria, Pedersen, warned that if conflict continues in Syria during the new type of coronavirus outbreak, large costs will be paid."
1594266920,"Bilecik Mayor Semih Şahin said that there were around 220,000 masks distributed by the municipality door-to-door, saying, ""Is there anyone who hasn't reached their home? If so, we've activated our Whatsapp line to reach us."""
1558123546,"In Izmir, the truck was trapped in the lower gate, in Konak district of İzmir, and the van carrying empty egg boxes was stuck in a subpass."
1623371372,"The suspect, E.B., detained under investigation launched by İstanbul Chief Public Prosecutor's Office after sending a second threatening message to the Hrant Dink Foundation, has been referred to duty-martial for two separate investigations against him."
1511891918,"There are some games where you have to get exactly three points, just like last night's match, because you're playing on your own field with one of your champions, and you need to score an absolute 3 points."
1603437551,"How do you apply for 10,000 TL support loans? The results of the individual supply loan started by the three public banks are continuing to question the results. How are the Agrikat Bank, Halkbank and Vakifbank, which offer the opportunity to use up to $10,000? How will the loan be submitted to the basic needs of citizens by 6 months and 36 months by national installment options. What are they going to ask for?"
1594004175,"""We have always been a team trying to do better,"" Youth and Sports County Director Murat Eski said, expressing that they reached many points they were aiming at in 2019."
1558605773,"A 70-year-old citizen in Merzifofon district of Amasya was defrauded of $42,500 by the person who called him on the phone and identified him as a police chief."
1611902233,National Defence Minister Hulusi Akar has made a statement regarding the outbreak of the new type of coronavirus (Kovid-19) and has tested 156 people in the Turkish Armed Forces (TSK)
1622103193,"Kremlin Speaker Dmitriy Peskov denies claims that Russia was involved in protests in the United States, that what happened was their internal affairs, Moscow's..."
1637225516,"President Recep Tayyip Erdogan's acceptance of MHP Leader, State Bahçeli has ended. His adoption of CHP Leader State Gardenli is over."
1553358361,"In France, the number of people who died in the new type of coronavirus (Kovid-19) has increased to 372 cases, to 10,95."
1558577269,"In his last-minute statement from Industry and Technology Minister Mustafa Varank, the new type of corona will be shielding the SMEs from the virus."
1607621210,"Turkey's Federation of Drivers and Automobiles (TSOF) President Fevzi Apadun said that the taxi driver, taxidermist and public bus driver are having a difficult time due to the reduction of passenger transport capacity due in half. Therefore, the prices should be updated and the road to reduce the victims should not be paid for the toll and bridge crossings until the process is over."
1490317697,319 suspects wanted for various crimes have been arrested in the controls conducted at Mardin Airport last year by Mardin province Security Directorate.
1585589993,"Last-minute News -- many measures have been taken to preserve social distance due to the outbreak of the corona virus in Istanbul, while a Nigerian national organised a birthday party for his newborn child. The police who raided the party imposed an administrative fine on 46 people while the Nigerians and 4 Turks who organised the birthday programme were sentenced to three months of house arrest."
1537904519,"Why Turkey is in Syria, Turkey's questions in Idlib are very simple and the broadest answer is: Turkey, in fact, is there for a 100-year struggle for independence. When maps, deals a century ago fail to occur, the rematch of those who dream of these dreams is now again through the same geography."
1596484746,"Konyalt Municipality has distributed five times its population masking, saying that they have distributed 1 million masks in the district since March 11th, Mayor Semih Esen of the Democratic District of Antalya."
1555438917,"Russia will send military virologists and doctors to Italy, where the most Kovid-19 deaths in the world have been seen, and medical equipment for Italy to defeat the new type of coronavirus."
1558562300,The Kırşehir Chamber of Commerce and Industry (TSO) reportedly launched a rotating and remote working period in some jobs under coronavirus measures.
1510990890,"In New York, a video called for a free ride to the subway by a masked group in the early morning protesting the 'cost' transportation fees and a series of shares on social media."
1526005385,"In Japan, two passengers on the passenger ship quarantined due to a new strain of corona virus have lost their lives. The number of people who died from epidemics has risen to 3 ."
1484906489,"In Çorum, the reaction of the truck and truck drivers' 'direction' response was reacted by a meeting on the Corrum-Khanway, which required downloading data from the number-traffographers that have been in effect in the new year and sending this data to the Ministry."
1559296701,"Frauds who knew the opportunity for the outbreak of KoronAVIRUS released fake vitamin pills saying, ""It's good for Korea."" Conspiracies put photos of doctors with fake flyers made by foreign doctors using their names, and the impression that the doctors were recommending the vitamin..."
1645086025,Decisions to appoint Turkish Rayn System Tools Industry Asş and Treasury and Finance Ministry have been issued in the Official Gazette.
1614407375,"If there were simple devices in nursing homes to give oxygen to the elderly, we could save two-thirds of the old ones, says Dr. Jon Tallinger, in his crying voice."
1537020893,"Republican People's Party (CHP) President Kemal Kilicdaroğlu spoke at the group meeting. Speaking about soldiers who lost their lives in Idlib, Kılıçdaroglu is my enemy no matter who shot my soldier. Why should I go to their feet? Your heel is running to Putin on your ass. No one should forget."
1490523441,"In the south of Cyprus, police asked the drivers who planned to go to Trodos to be very careful."
1576933754,Mamak Mayor Murat Köse said they have prepared a support package for the tradesman who is shouldering the labour burden due to Kovid-19.
1581843572,"Antalya Metropolitan Mayor Muhittin Bug, sharing their services in ALTSO co-operation with the city's social media accounts..."
1566545655,"Everyone is on alert from seven to 70 after the outbreak of coronavirus, which is worrying about the rate of spread."
1558608039,"Turkey, the world, breaking news, veteransmansha, yübüp, sültpaşa, sutangazi, conqueror, arvutköy, magazine, politics, policy, current, police, security, agenda, last minute, flash, sports,"
1641687779,"Corporal Ertugrul Köse, who was a martyr in Operation Talon-Kaplan, which took place in northern Iraq, was buried in his hometown of Osmaniye."
1494278873,"Agricultural Insurance Pool Company's General Manager, Sepil Günal."
1508872308,"Sungurlu Mayor Abdulkadir Şahiner paid a visit to the village of Doğanyol, Malatya, where the earthquake was felt violent, which occurred at 6.8 in Elazığ district of Dikce."
1620996949,"'Will KYK debts be expunged, will RSR loans be restructured?' again on social media."
1833783163,The Labour Health and Occupational Safety Assembly (İSIG) announced that seven workers were killed in İzmir due to the coronavirus.
1581923195,We have a quarantine in a neighborhood quarantined under the Korana virus measures starting this evening.
1558463768,"In Izmir, the percentage of people using public transport has dropped 79 per cent due to the new type of coronavirus (Kovid-19) measures."
1548742691,The training work for Hillside Park Gardens Directorate staff focused on sustainability in plant farming.
1558608041,"Turkey, the world, breaking news, veteransmansha, yübüp, sültpaşa, sutangazi, conqueror, arvutköy, magazine, politics, policy, current, police, security, agenda, last minute, flash, sports,"
1562266583,"SUGAR announced that milk consumption has been reduced due to measures taken against Koronavirus, and that the producers will not receive open milk for the weekend. The animal manufacturer has reportedly left 30 tons of milk."
1558579032,"One of the two defendants convicted of drug trafficking in Eskişehir was sentenced to 15 years, 7 months, 12 years and 6 months in prison."
1593980272,"Berke Özer, the goalkeeper who was flown from BELCİKA, is a member of the 328 Turkish citizens who were quarantined in the dorms of Tripoli and Silverhane, and has rented the Belgian 2nd League team to Westerlo, continues their individual training in his dorm room under surveillance."
1558566736,The Director-General of the Mersin Water and Sewering Administration (MESKI) said that the corona virus measures will provide ease for subscriber services through the WhatsApp line.
1558576281,What are the conditions of unemployment? The questions are curious by the citizens. The unemployment benefits are being carried out through ISKUR. How do you apply for unemployment benefit?
1512678466,A pregnant woman and her five-year-old son were found dead in Menemen district of İzmir.
1616782410,Costa Rica became the first Central American country to legalise gay marriage.
1558883689,"Turkey, the world, breaking news, veteransmansha, yübüp, sültpaşa, sutangazi, conqueror, arvutköy, magazine, politics, policy, current, police, security, agenda, last minute, flash, sports,"
1558613605,"At his last meeting, the Radio and Television Supreme Council (RTÜK), which took viral broadcasts to the lens, imposed administrative sanctions on three channels that violated the law in the coronavirus publications."
1520352310,"The school principal, who kicked the student in the face, was charged with 'simple injury' at the Isparta Asliye Criminal Court."
1590940001,"60,000 civilians living in rural areas of the Syrian cities of Idlib and Aleppo received Ramadan assistance with food and hygiene supplies."
1643372588,"In the first six months of 2020, the city of Kosinan, which contributed to Turkey's economy with recycling projects, recycled 2,37 tonnes of paper waste, preventing the cutting of 34,629 trees."
1569886546,"The number of cases in Israel reached 8,611, while the death rate increased to 51. - Anadolu Agency"
1628233543,"Tanker Contracted Private Ismail Anayurt (25), who was injured in the terrorist attack in Idlib, Syriae, was killed by the 43-day war on life."
1520046014,"Turkey's Exporters' Assembly (TIM) and EGE Export Units exported 272m 446k in January in Manisa, according to data."
1534908109,"In Ağar, the ceremony was held by the Turkish Kızılay Pain Branch for the soldiers who were killed in an air strike by regime forces in Idlib, Syria."
1558557287,"""I don't have any symptoms, no fever, and no cough,"" said Galatasaray Club President Mustafa Genghis."
1561605229,"Three young people brought from Ukraine to Turkey due to the outbreak of Koronavirus found that they had opened a live broadcast on social media at the student hostel in Bolu, where they were staying in Ukraine, and cursed against Turkey. As the reactions to images escalated, Boli Public Prosecutor's Office launched an investigation into the incident."
1556346073,New Type Koronavirus Death rate calculated at 1.4% in Vuhan
1486138610,1 person has been arrested in a drug and prostitution operation launched by the gendarmes in ÇaNAKALE.
1568625153,The practice also began in Mudla after the country's coronavirus measures were imposed on public transport vehicles to wear masks.
1558871514,Alanyaspor Technical Director Erol Bulut issued a message for Fenerbahçe saying that a football player and a health team employee have found new type of coronavirus (Kovid-19) findings.
1541225602,"""We have to understand, Turkey's burden is heavy,"" said EU High Representative Josep Borrell, regarding Turkish refugee policy."
1548775648,Six suspects who were detained on charges of illegal trafficking of blank pistols they had replaced their barrel in Adana have been released.
1633215996,"In a search of a truck in Antalya, drugs were seized on the steering wheel and methamphetamine in the driver's seat."
1606942069,"Police officers reported gambling in a warehouse in the district of Dinçer, Dühzadeler, Manisa."
1558587229,"The new type of coronavirus (Kovid-19) detected in the Philippines has risen to 636 cases, while another senator has been identified as carrying the virus. - Anadolu Agency"
1522059801,"The Judo Young Turkey 1st finals began in Afyonkarahisar, as part of school sports activities in the 2019-2020 Education-Teach Year, organised by the Ministry of National Education and the judo Federation."
1495939165,"In Sivas, the National Parks Department of Nature and Nature Department co-ordinated training to support prey and wild animals in their natural environment, provide for their needs in winter conditions."
1514815139,"A nearby village was evacuated in Canada, where an oil - carrying train went off the rails."
1558902160,Ankara Metropolitan Mayor Mansur Süçük said that the permits for municipal personnel with children under 12 years of age have been extended to the same date due to a break in education in schools until April 30th.
1561669608,The streets in Ağrı have been flooded despite warnings of staying at home. Citizens in Pain filled the streets and streets despite warning of quot Evkot against the virus.
1577276042,Belarus President Aleksandr Lukasenko claims that he did not lose his life because of the new type of coronavirus (Kovid-19) in his country.
1610187682,"I believe that this country will rise on the shoulders of the idealistic, patriotic, caring young people, and will again find life in the great Turkish ideal."
1560431830,"In breaking news, Trade Minister Rusar Pekcan is holding a press conference on non-communicational foreign trade efforts carried out under measures against Kovid-19 in the service of the Baku-Tiflis-Kars railway at 2,500 tons of trade at the request."
1514914913,"The question of when the ESF recording renovation will continue to be carried out by the students at Anadolu University School of Open School is being investigated intensively, while these procedures are known to take place before the start of the new era."
1567551112,"In his statement, Mustafa Harputlu of Alanya warned the citizens that they had taken action under the direction of the governorship of ANTALYA."
1517391403,ALKUD will organise an earthquake information seminar along with the Alevi Cultural Associations' Aliba branch Youth.
1558581143,"The Great Unity Party (BBP) is announcing the anniversary of the death of Konya Province President Osman Selugin, BBP Founding President Muhsin Yazıoğlu and the five others who were with him in Kahramanmarash on March 25, 2009."
1638420888,"The guards in Söke were trained by 25 districts and neighborhood watchmen in the District of Süke, Aydın Province."
1613900586,"Science Board Member Çelik replied: Would the cargo package be infected? Health Ministry Koronavirus Science Council member Prof. Dr. Ilmi Çelik said, ""It seems impossible to have a virus in the package from Kargo that will make you sick. The virus can, of course, be found; but there is not enough to make a person ill. There is no need to worry about them."""
1567690527,"Police have taken precautions at the entrances of many mosques, including the symbol of İstanbul's Eyup Sultan Mosque, Sultanahmet mosque, Fatih Mosque and the Grand Pinelıca Mosque. - Anadolu Agency (AA)"
1646293198,"Harun Reşit Çetin, accused of causing a car accident that resulted in the death of Kemal Aydın and his wife Ayla Yılmaz Yılmaz Aydın, will remain in police custody for three days."
1487174072,"A National Short Film Contest will be held as part of the Institute for Development of Integrating Education (BEGEP), which the Ministry of National Education has launched."
1498327714,"In basketball, the ING All-Star 2020 was announced as the top five players of the team to compete tomorrow."
1629186035,"The words of the martyr mother: 'I will stand strong, my child, I am not crying', at the ceremony held for Private Ismail Anayurt, the fallen mother of Marine Tankist Contractor, who was wounded in Idlib, Syria, where he was treated after being wounded."
1551141534,When Venezuelan President Nicolas Maduro is already in crisis because of the pressure of sanctions to fight the new type of coronavirus epidemic in the international...
1574184085,"A large number of homeless cameras lie under the Hashim Ishcan Pass in İstanbul. A homeless person under a subgate, I did not go to the shelter."
1504366595,"Due to the fact that our country's active fault lines are stretched out and have been placed in the earthquake belt, there are often small earthquakes, especially since the last minute earthquake occurred in Erzurum Dikce called the 6.5-strength earthquake, the citizens of East Anatolian fault line is what?"
1581062226,"Under the new type of coronavirus (Kovid-19) measures, the decision of the Marmaris County Committee on Umumi Hfzizsihha has been made to establish waiting spots in the district and to receive the Ramadan pit from each family."
1488910467,"Turkey, the world, breaking news, veteransmansha, yübüp, sültpaşa, sutangazi, conqueror, arvutköy, magazine, politics, policy, current, police, security, agenda, last minute, flash, sports,"
1581112228,"A photo shared on social media received a huge reaction. A police car owned by the Police Department, which issued a traffic ticket to thousands of vehicles over the year, also cost the citizen's reaction by parking in a handicapped parking spot and by crossing the road."
