id,text
1577007072,"Eight people who beat the coronavirus in Sinop applauded, and eight people were discharged from Sinap, who had completed the new type of coronavirus treatment."
1571177095,"Fugitive mask operation in Kütahya: 3 detention wards have been seized by illegal surgical masks with 5,500 gloves and 300 disinfectants, 3 suspects in custody."
1642410655,"Last-minute News - Silivri Municipality has announced that the destruction of four illegal structures found in the villages of Çayırdere, Danamandira and Sayalar has been carried out as part of the fight against illegal buildings."
1494552182,British Prime Minister Boris Johnson reported his refusal in a letter to Scotland Regional Chancellor Nicola Sturgeon demanding a transfer of power to the independence referendum.
1498553472,"The low growth figures, resulting in political uncertainty, social tensions and economic destruction, have brought the trend of permanent, small companies, a series of bankruptcys. The Global Bankruption Report, released by the world's leading insurance company Euler Hermes, revealed the picture of global bankruptcy increases in four years in a row."
1594300162,"A total of 3,837 administrative and judicial procedures have been carried out, including 2,372 violations of the social distance rule in the national audits, particularly 31 counties prior to the three-day curfew. The 12th, 837 persons violating the rule of non-existent closure were subjected to administrative, administrative procedures, and legal procedures to 82 business managers -- including 20 years under 1231 and 234 years of age 65."
1558472637,"In Antalya, beggars wore masks in ANTIA until evening, it was seen in the streets, with no hygiene rules, to beg for money from the citizens, that they were wearing masks due to the outbreak of coronavirus."
1573325721,"The police have issued a fine of $79,500 to 25 people in coffeehouses, which determines that the two coffee shops should be closed under coronavirus measures."
1558632832,"The philanthropist, who helped low-income families in both Istanbul and various provinces, appeared in Esenyurt and Albanianköy this time. According to the breaking news, the mysterious benefactor helped citizens because of the virus epidemic. Citizens don't know their name..."
1622213919,"""Everything that goes on there is the internal affairs of the United States. We have never interfered. Now we are not prepared for interference,"" Kremlin spokesman Dmitriy Peskov said in a statement against ongoing protests in the US."
1558581161,"In Antalya, 65-year-olds and over-the-clock people who ignored warnings about coronavirus measures spent time sitting on the street bench, by the pool. In the city where young people were not outside, a line was found to be lined up in front of a bank without being followed by social distance."
1531323159,"President Recep Tayyip Erdogan assessed the Syrian crisis before the Azerbaijan trip. He sent a clear message to Moscow. President Erdoğan has given all support to the Syria regime, including air."
1509271664,The 16-hour interrogation of US President Donald Trump in the ongoing Senate trial began around whether or not new witnesses were summoned.
1558744812,"Last minute... the break for education has been extended until April 30th because of the Corona virus, when Health Minister Fahrettin Husband and Minister of National Education Ziya Selçuk discussed the latest measures taken. Minister Big has announced that the school holiday has extended. National Minister Selcuk said the schools have been vacationed until 30 April."
1648130067,"After the conflict, India responded to China digitally! India banned 59 Chinese-based applications, particularly the popular Tik Tok app worldwide, for damaging sovereignty and territorial integrity."
1620397372,"In Konak district of İzmir, the car that had not been pulled off the hand brake flew down the stairs. No one was injured by chance during the children's play in the street."
1558583192,"In the closed market, the corona silence in Kahramanmarash became silent because of the korona virus."
1574351828,"As part of the measures of İstanbul Metropolitan Municipality Kovid-19, he placed thermal cameras in subway stations, where the number of travel is high. Those with high fever are being directed to the nearest health institutions."
1585771570,Work has been started by the contractors at Lake Salda in Burdur to relocate the sands that have been moved to a different location with the trucks and the machines that are being loaded into trucks instead of the work machine.
1527714674,"In the United States, the revenue of 30-year government bonds is the lowest of all time, with concerns that the coronavirus outbreak will negatively affect the global economy."
1554843555,3 young people in Zile district of Turkey are volunteering grocery shopping for their elderly neighbors who are in need of an outbreak of coronavirus.
1558541051,Resilience shipments in the United States have increased by 1.2 per cent per month in February to $29.4 billion.
1576968072,"In Adıyaman, travel between boroughs and districts has been banned."
1526039554,A woman's lifeless body was found in the pond during the night in Malatya.
1512712924,When is the 2020 guard hiring? What are the terms of the guard's application? The candidates who want to take charge in the markets and neighborhoods are waiting to hear from the EGM. They're also announcing their application requirements as well as the hours of EGG guards. But what are their guardianship applications?
1558605452,"One of the football players in Fenerbahçe and an employee of a health committee found a corona virus, the Fenersbahce Club, a footballer and a medical board member."
1558181315,The special public bus to the IBB in Fatih Aksaray was refuted after the driver lost control of the steering wheel.
1583391365,"Hatice Dalboy, 70, who lives in Balıkesir's District of Borders, donated 350kg of chickpeas to the needy."
1584783868,British Prime Minister Boris Johnson discussed the fight with US President Donald Trump (Kovid-19) with the new type of coronavirus.
1627597711,"883 cases have been detected in Belarus in the last 24 hours, 4 people have lost their lives, as the total number of cases has risen to 47,751, and the death toll has increased to 263."
1637483320,Morocco has sped up its efforts to evacuate citizens staying in Turkey due to COVID-19. Prime Minister Sadeddin al-Osmani has announced that 1400 citizens have been brought to Morocco by now.
1556386292,"The Palandöken municipality, which received appreciation for its effective fight against Koronavirus, has also adopted an exemplary service."
1626147872,The car that crashed in Gemlik took a tumble and flew to the olive field: 3 injured vehicles that were out of control in Bursa's Gemli County flew 300 metres into an olive grove.
1497866818,"""Who is Rahşan Ecevit and how old was he?"" The question began a intensive search. Turkish politician, writer Rahsan Ecevt lost his life. In 1946, former prime minister Bkent Ecevit, married to Ecevic, who was 97 years old, passed away at the hospital where he was treated. He was originally resigned from the Democratic Left People's Party from Thessaloniki to Şbinkarahisar, and was the founder of the Party of Democratic Sol and Democratic People. Writing, art and politics. Ecavit knew very well in English."
1615840173,"Under 20 years of age counts as a day to go back to the street. Under the age of 20, curfews under coronavirus measures can be put out on the streets on specific days and hours. But when can under 20 get out?"
1494628070,President Erdoğan has accepted Minister of Sports Kasbaşoğlu and representatives of the football community. TFF President Nihat Özdemir was also present at the meeting.
1558377216,6 million masks that Germany had ordered for urgent needs have disappeared.
1555751225,Minister of Environment and Urbanism Murat Kurum said that there will be no rent price for this process from commercial units which are assigned to the Treasury and whose activities have been halted.
1615423884,Kütahya Governor Omar Toraman and members of the protocols visited the Kitahiya Air Martyr and Police Martyrs on the first day of Ramadan Day.
1596661471,One of the most important agendas in the presidential cabinet gathered today was the Passing Exam (LGS) and the Higher Education Institutions Test (YKS).
1558563137,"Ankara Security Directorate has announced that a university student has been taken into custody who has made provocative shares in the outbreak of the coronavirus. In a statement issued from Ankara Police Directorate's Twitter account, some social media accounts have sent a coffin to Ankara' and 'In a hospital, 104..."
1596552344,"President Erdogan said the return to normal life would be gradually initiated, saying a normalisation plan was under way."
1558579213,"According to recent reports in Yozgat, 11 people were fined $13,475 in fines. Local Security Directorate Security Department teams launched a study on reports of people gambling in unsanitary conditions. 13 BIN 475..."
1552868611,"In the Army, the measures for the corona virus have been changed within the military as part of the anti-chorona virus measures."
1563821009,"The public banks will provide non-refundable 36-month loans to those with a monthly income of 5,000 euros and below. Those who borrow $10,000 will not repay the first six months. Minister Colonelrak said that we continue to support the needs of our citizens with all our institutions, Corona..."
1604617860,"The Palestinians in Egypt began to cross the Gulf Border Gate, which the Cairo administration opened as ""issnai,"" to the Gaza Strip under blockade."
1602083005,Zonguldak County Health Director Uzm. Dr. Ertugrul Güner made a statement on May 9th World Desert Day.
1558593432,"According to last-minute reports, 35 suspects have been taken into custody in an operation against drug dealers in Gaziantep. The report from the District Security Directorate says that the Şahinbey District Police Directorate teams have made an action against the addresses set up in the city as part of their anti-drug efforts."
1604694239,"EU High Representative to Foreign Relations and Security Policy Borrell, the outbreak of COVID-19, Middle East and North Africa, as well as various parts of the world..."
1573761452,British Prime Minister Boris Johnson was reportedly released from intensive care three days later when he was treated for a new type of coranavirus (Kovid-19).
1606125485,"The President of the Farmers' Union, which publishes a message on World Farmer's Day, Kelil 'Cypris Turkish People, has agricultural production, a job for ancestors."
1574106524,"As part of the new type-corona virus epidemic, measures have been raised to the highest level, one of our country's most affected by changes has been market hours, and the Home Office has issued a summary on market working hours and sent it to governorship of 81 provinces."
1630941834,Germany extended its travel warning to more than 160 countries until August 31st.
1512625538,"In a statement to the press, four employees who made a sign on the bus at the City Hats have been fired. Heshmatpour said that the investigation was carried out yesterday on other drivers who had not made Bozkurt marks in the video but did not make any signs. Yesterday, he said he was a bus driver of the Vienna City Line and a Turkish driver."
1513209740,The sea buses in Bursa and Istanbul canceled some of their flights because of the negative weather in the Sea of Marmara.
1491465225,"The 1512 Individual Youth Enterprises (BIG) programme, which provides unrefunded support to entrepreneurs for up to 200,000 TIBİTAK, has started 2020 new term applications."
1620820303,The couple who were attacked by the cat on their website struggled for a long time to get rid of it.
1558500696,"""I believe I may be better than my former performance because of this postponement process,"" said Ibrahim Çolak, a national gymnast who had shoulder surgery three weeks ago. - Anadolu Agency."
1578688252,"""As of March 28th, when transport and infrastructure Minister Adil Karaismailoglu was restricted to carrying passengers on our railways, we mobilized all possibilities for cargo transport,"" he said."
1644085848,"The famous singer Alishan's wife, Buse Varol, and their two-year-old son Burak were in a car accident on their way to Bodrum."
1640602326,"The construction, maintenance and repairs of the roads must be slow, followed by traffic markers and beacons."
1558804848,The DG Sivasspor Club released a message from Fenerbahçe explaining that the coronavirus test had positive findings on the health worker.
1587544805,"The 100,000 New Social Housing Project will begin drawing lots again on Tuesday (April 28th), before the notary, but closed to the participation of citizens..."
1507055382,The Metropolitan Municipality is spraying schools for students to study in a cleaner and hygienic environment during the semester holidays.
1602443708,"A certificate to Mothers of Paradise, over 100 years old in Kadirli, the Hatice Foundation and the Ministry of Internal Affairs, established in Sakarya for mothers, in the Memorial Forest of Heaven, where the tree was planted in his name, to the 100-year-old mother of Osmaniye, Minister of Interior Süleyman Soylu..."
1558597435,CHP has announced its 5-point proposal to the AKP following talks on criminal execution arrangements.
1604126188,China has announced that objects are sending two satellites into space with the Internet (IOT) technology.
1552729096,"Two brothers, who hanged their apprentice to the palanga, known as the ""Carascalsal"" in Konya, were ordered to be released with a judicial control order for the trial without arrest."
1558591711,"Adıyaman's Corona Mayor Alexander Yıldırım supported a call by the Ministry of Health to ""Stay Home"" in order to prevent the spread of the new type Korona Virus (Kovid-19)."
1501697833,"Nickolay Mladenov, UN Special Co-ordinator for the Middle East Peace Process, said that the possibility of a two-state solution in the Palestinian-Israel issue would be gravely impacted if the entire ""C"" region or part of the occupied West Bank is ""independent to Israel."""
1558585466,"Last Minute - Minister of Transport and Infrastructure Mehmet Cahit Turhan called on citizens to stay home because of the corona virus outbreak, saying the Corona virus is not stronger than any measure we can take."
1580929185,"As the ""Sungurlu"" slogan supports the relief campaign, the municipal teams are growing up like an avalanche, while the collection of relief boxes is being delivered door-to-door to the needy."
1532223952,KTAMS issued a press release in front of the court on charges of assault and battery of executive officer on Pier
1576087296,"In Spain, the number of people who lost their lives in the COVID-19 epidemic has increased to 619 over the last 24 hours to 16,972."
1641687789,"The PKK's Syrian organisation, YPG, wants to be exempted from sanctions against US Assad administration."
1624222879,"5 star hotels, whose marble powder was white sanded on the beach in Bodrum district of Mugla province, were fined by the Environment Urbanism City Directorate and Bodun municipality. The municipality carried out a fine of 310,000 TL and the municipality imposed 35,000 euro."
1648043923,"The government of India has banned 59 Chinese-based practices, particularly TikTok, UC Browser and WeChat, on the grounds that it has damaged the integrity of the land and the legislature."
1608262507,"President Erdogan announced that curfew would be imposed on May 16-17-18-19, with a total of 4 days. Citizens are curious about the latest situation on the list of names in the provinces."
1590412143,"In France, the number of people who lost their lives due to Kovid-19 has increased by 437 in the last 24 hours to 23,293. - Anadolu Agency"
1561428527,"The outbreak of coronavirus COVID-19 also brought to a halt the supply chain of the automotive sector, which has created more than 200,000 jobs, as it affects many sectors."
1516949531,The Stock City ran a snowplowing and salting effort to minimize the negatives that could have been experienced with the snowfall that started last night.
1559027282,French President Emmanuel Macron said the troops would contribute and contribute to the fight against the new type of coronavirus (Kovid-19) epidemic.
1602384629,"Aliye Baydar, 55, a mother of 5 children living in pain, makes a great sacrifice, providing for his wife and her first wife, who had cancer, and for her son, all kinds of needs alone."
1552856208,"In Spain, 209 more died in the last 24 hours due to the coronavirus (Covid-19), total death has risen to 767, and the number of cases has increased to 3, 431, 17,47."
1536083017,"In breaking news, National Defence Minister Hulusi Akar has announced that 2 fighter planes, 2 drones, 135 tanks, 5 air defense systems and 2557 regime elements have been neutralized as part of Operation Spring Shield."
1642524808,"Since the curfew will be imposed on 27 June and 28 June 2020, the Lotus Municipality has rescheduled the days for the opening of the weekend neighborhood markets."
1558584081,"Lived at ATV, Esra Erol branded his program with the truth about Ali Akkoc's runaway wife, Baha Akkovic."
1558746898,Education Minister Ziya Selçuk and Minister of Health Fahrettin Koca have made a joint statement. Remote education has been extended until 30 April. The number of cases across Turkey was announced as 1872.
1625783356,"According to the breaking news, the foreign national woman he took into his vehicle in Taxi is sentenced to 2 years in prison for assaulting and 'simple injury' for the alleged taxi driver, who had first argued with the passenger and then got the fare of the road."
1558575434,"The applications will be submitted from March 26, March 30th through the website of Turkey's Business Institution."
1603080245,"Although there has been a decline in housing sales since March along with the Korona virus outbreak, the Elfi Real Estate Founder Özkan Aydemir has said there is a demand for housing investments, and the fact that housing loans have been raised from 80 to 90 per cent is an important gain for the sector."
1647534820,"According to a written statement from the Ministry of Agriculture and Forestry, one of Turkey's largest electricity production projects, the first electrical production unit of the Ilisu Dam was attended by President Recep Tayyip Erdogan on May 19 at the Festival of Ataturk, Youth and Sports."
1566539710,"US President Donald Trump does not declare a national curfew to prevent the spread of the virus, despite estimates that hundreds of thousands of Americans will die due to Covid-19."
1560515863,"In the work conducted by gendarmes in Turkey's southeastern province of Hakkari, 100 kilos of powdered marijuana, 55 kilos 500 grams of heroin and a thousand 100 boxes of medical medicine were seized."
1630206618,"The person who went to the bakery to buy bagels in Deepa caught fire with his wife and children, and the moments when the citizens who intervened in the fire prevented the potential disaster were reflected on the security camera."
1601284320,"A certificate by Interior Minister Süleyman Soylu will be provided to elderly mothers named after them in the memory forest, which would be co-founded by the Hazreti Hatice Foundation and the Interior Ministry."
1618925054,Turkish Meteor Tracking Systems Project Player and Professor of Physics Department of Science at Aegean University.
1617042694,The number of lynxes in Elazığ district of Karakoçan has been seen under protection in recent years.
1596308068,"In Söke district of Aydın, administrative penalties have been imposed on those who have not followed the rules imposed in the curfew imposed at the end of the week."
1623287278,"According to data from the Turkish Statistical Institution's TÜİK slayial Regional Directorate, 54 people were killed in traffic accidents in Sakarya, in 2019, while 4,10110 others were injured."
1628704622,"The drop in gold prices is followed immediately. Gold prices are changing daily, causing movement in the economy. The price of gold, which is one of the most profitable tools for investors, is also found among the things that have been researched."
1525485646,"'Russia and Turkey have to play a key role as guarantor countries in Idlib to reduce tensions,"" UN Special Representative to Syria Pedersen said."
1572293243,"With the statement of Agriculture and Forest Minister Bakir Pakdemirli, the chain market cost was set in record sales of sea bass and chippuras from Eskişehir."
1550804432,"Last-minute News has also taken public measures against the Corona virus (COVID-19) in Turkey. Places in Silivri have closed down in the Siliviri area, which matches the generalisation of the Ministry of Interior."
1485380103,"Four relatives have stolen a million lira worth of valuables, entering empty houses they found for a month at various points on the Istanbul Anatolian Side."
1561345928,"Turkey, the world, breaking news, veteransmansha, yübüp, sültpaşa, sutangazi, conqueror, arvutköy, magazine, politics, policy, current, police, security, agenda, last minute, flash, sports,"
1542706012,"In order to get old clothes, shoes, and toys that were not used to be used by the Kırkkale municipality, they placed clothing boxes in different parts of the city to deliver them to those in need."
1498227160,Rahşan Ecevit was announced to be buried in the state cemetery tomorrow next to Bulent Ecevit.
1631980570,"After the normalisation process in Istanbul, citizens flocked to the beaches, but recently increased marine pollution attracts the attention of citizens. A brown layer has been found to contain abundant household waste and jellyfish."
1612668336,"The price of gold is at $376.5 lira after it starts at a drop in the day, and at the same time a quarter of it is sold at $618 and the gold of the republic at $2,517."
1576137391,"Breaking News - the young man who tried to break the curfew in Bursa, when he found out there was going to be a ticket, cried, then attacked the journalists in charge."
1564058992,"In ISPARTA, 293 of the 586 people who have been quarantined for 14 days under the protection of coronaviruses began to be sent home negatively tested."
1562515428,"British Deputy Director of National Health Harries has made statements about the outbreak of coronavirus, saying that the return of everyday life could be six months, and the deaths would increase in the next two weeks."
1591126729,US Permanent Representative to NATO Hutchison thanked Turkey for its medical supplies for the outbreak of Kovid-19. - Anadolu Agency
1558606313,"Osama Yusuf Gürbuz, a graduate student at the University of Newcastle Engineering Department, brought to Turkey under coronavirus measures from students studying abroad, said, ""This has really made us feel again how old and great our state is."
1558334375,"In breaking news, Minister of Environment and Urbanism Murat Kurum said, ""We have cancelled the tenders for the Treasury movers in closed or open order. There will be no tender until the end of April."""
1559296692,"In our country, which is located between the countries of the earthquake belt, located at the reach of two active fault lines, Northern Anatolia and East Anatolia, there are earthquakes in various sizes from abroad and abroad, so our citizens are curious about the latest earthquakes that have occurred..."
1558463603,"Under the decisions made by the Ministry of Health and the Department of Interior, the Düzce City Police Department teams have made a mistake in protecting citizens and preventing the spread of the epidemic within the scope of fighting the coronavirus."
1598426157,National Ministry of Education (MEB) Teacher Development and Development Director Adnan Boyacı said Turkey's new type of coronavirus (Kovid-19) intervention strategy is an example to the world.
1625596738,Snapchat announced that Donald Trump will no longer be brought forward in the discovery section of the practice.
1628786465,"There were serious decreases in the case and mortality rates as the experiments on the corona virus continue to dominate the entire world. As last minute information for the Corona virus continues to come in, there was a first time in Turkey for a virus. Here are the details. The last-minute reports of the corona virus..."
1500464984,"Hasan Akkoyun (63) who lives in HATAYA returned to the university with a student pardon after dropping out of law school in 1975. After his graduation, he took the oath and took his license to become a lawyer."
1593248979,"Libya's legitimate representative to the UN, the National Covenant Government, has released footage of the moment when the convoy carrying ammunition to Hafter, leader of illegal armed forces in eastern Turkey, was hit by armed drones. - Anadolu Agency"
1558728160,Disinfecting operations under the new type of coronavirus (Kovid-19) in Erzurum and Iğdır continue continuously.
1639408726,Minister of Environment and Urbanism Murat Kurum has made statements on the moving project of industrial areas in the city's centre.
1605033735,"UEFA and TFF Health Board Member Prof. Dr. Mete Düren gave Haberturk an exclusive interview. He said that football began much earlier than the USFA Health Council predicted yesterday, while ""In the end, when we consider the physical properties of the facilities that we publish, we need them to apply their facilities outside of it."""
1513729103,Those who applied for work online became targets of crooks.
1559011342,The Saudi Arabia administration has tightened its methods of intervention against the Covid-19 virus.
1610725954,İstanbul Metropolitan Mayor Ekrem Imamoglu opened Ataturk Kent Forest in Hadjiosman.
1645373429,Ýzmir's local news and current news address
